{
  "asOf": "2026-08-27T10:10:00Z",
  "bridgeProfile": "cgqa-smart-contract-continuity-bridge-v0.1",
  "bridgeStatus": "BRIDGE_READY",
  "claimBoundary": "ContractGraph-QA validates and projects supplied reviewed evidence into the pinned LTP v0.1 envelope contract. Only the normative LTP verifier may compute continuity status, and its report remains bounded by the supplied snapshot.",
  "inputDigests": [
    {
      "logicalId": "release-attempt-1",
      "role": "intent",
      "sha256": "9703cfd36e43b7d8c3a47e1bf8c17be008040448b8ccf3e546485cc577e17f9e"
    },
    {
      "logicalId": "release-attempt-2",
      "role": "intent",
      "sha256": "c6abd036ace62edf4878d73fbb1640fa4d36d8ba5608cbb58784f9ed66f69092"
    },
    {
      "logicalId": "api-released-42",
      "role": "observation",
      "sha256": "3a3302a3cd449ff591c3b90dc80e529d67763997784f2e9bb1481bf11bb7b936"
    },
    {
      "logicalId": "api-request-42",
      "role": "observation",
      "sha256": "27da55cf06f6066bdfdc195dc66d4e1b52e30b5efb806571e06c0ee46339a494"
    },
    {
      "logicalId": "backend-released-42",
      "role": "observation",
      "sha256": "edaa2d8721a75ff1acef2ddaf201b617494645971edd691a1f81b1f7f72f4ae9"
    },
    {
      "logicalId": "backend-request-42",
      "role": "observation",
      "sha256": "c519fe62c7c84beef28305ab21873ea83360efa784e3c30277575551912f35f9"
    },
    {
      "logicalId": "delivery-accepted-42",
      "role": "observation",
      "sha256": "b8189fb0db2a6a4054d465172c733ee43f9951da1f979161e69b612fcef73ce8"
    },
    {
      "logicalId": "delivery-request-42",
      "role": "observation",
      "sha256": "1451af27dd2a491a51ca3ac32924e0cb20783129dacdfa166ff6e73fabea32aa"
    },
    {
      "logicalId": "deposit-completed-42",
      "role": "observation",
      "sha256": "7b7bf09220656edbebb92069a9de61e488de28cb9eccccea8237865575c1b9c4"
    },
    {
      "logicalId": "deposit-request-42",
      "role": "observation",
      "sha256": "9b9a409714f44ee3d47f69340c23f8b1db7397fd9fce0a2fa1f2c081732e8752"
    },
    {
      "logicalId": "indexer-request-42",
      "role": "observation",
      "sha256": "a9425033dc527aa8b115293983045153db5d07aac065f402918907ec17444f80"
    },
    {
      "logicalId": "indexer-updated-42",
      "role": "observation",
      "sha256": "0b3ba44238861895fb1197d5bd4a72f89d6847dd39e765da0ca92a6b60eb5605"
    },
    {
      "logicalId": "release-receipt-42",
      "role": "observation",
      "sha256": "b3f21e15a0f1406b2b130bfd66f58e17ff22cdc9f0a626219258abc839979c0d"
    },
    {
      "logicalId": "0xbbbbbbbbbbbbbbbbbbbbbbbbbbbbbbbbbbbbbbbbbbbbbbbbbbbbbbbbbbbbbbbb",
      "role": "receiptTrace",
      "sha256": "3049164c7c58e3f3011df3f596b83d7b5be959d7935ab51bd9df132090c2c7f5"
    },
    {
      "logicalId": "0xaaaaaaaaaaaaaaaaaaaaaaaaaaaaaaaaaaaaaaaaaaaaaaaaaaaaaaaaaaaaaaaa",
      "role": "rpcCapture",
      "sha256": "aa6ea204bf3f16636e7fc4f410ce0cbccbfe41bbbaf3df888cb949177348d548"
    },
    {
      "logicalId": "0xbbbbbbbbbbbbbbbbbbbbbbbbbbbbbbbbbbbbbbbbbbbbbbbbbbbbbbbbbbbbbbbb",
      "role": "rpcCapture",
      "sha256": "298ff20b107ceb7fa8a2a7e8a43b15ce265c9e6669c85c484ba046ef83a9ad79"
    }
  ],
  "limitedRootRequestIds": [],
  "ltpContract": {
    "commitSha": "08734d248c24dfb2ee8e4f4a3f689887ead0ea24",
    "repository": "safal207/L-THREAD-Liminal-Thread-Secure-Protocol-LTP-",
    "schemas": [
      {
        "path": "docs/contracts/ltp-request-envelope.v0.1.schema.json",
        "sha256": "721d2482c88abf91c7e511614b4c81d39a8b0408ccc2fd41d014d356b3f9a86e"
      },
      {
        "path": "docs/contracts/ltp-outcome-envelope.v0.1.schema.json",
        "sha256": "9a6b2cdb88e8ad82dd71c8a82cb0cea2f68fdc07f3b68ed2b129fd4534f01be7"
      },
      {
        "path": "docs/contracts/ltp-request-outcome-continuity-input.v0.1.schema.json",
        "sha256": "e12b9ed0d5127b45d53e4168fdd9a911c577dad24abdaa0db918b091886045aa"
      },
      {
        "path": "docs/contracts/ltp-request-outcome-continuity-report.v0.1.schema.json",
        "sha256": "f826852ed6170651f66b1e274c8cd8b2632bc84f5ad58d0720fa989a9bb4d4ac"
      }
    ],
    "treeSha": "5eb684d990701fa959f0b2a87125ebd765df70cd",
    "validationCommand": "pnpm -w ltp:continuity -- <input.json> --out <report.json>"
  },
  "ltpInputSha256": "a2cfcfcf97552c22874dc373397f03a0092af6e1832a48af902f0214d6bcad82",
  "mappingDecisions": [
    {
      "attemptId": "release-attempt-1",
      "outcomeProjection": "NOT_EXPORTED",
      "reasons": [
        "MISSING_REVIEWED_RECEIPT_BINDING"
      ],
      "requestId": "release-escrow-42",
      "requestProjection": "EXPORTED"
    },
    {
      "attemptId": "release-attempt-2",
      "outcomeProjection": "EXPORTED",
      "reasons": [],
      "requestId": "release-escrow-42",
      "requestProjection": "EXPORTED"
    }
  ],
  "nonClaims": [
    "No continuity verdict is computed by ContractGraph-QA.",
    "Observed confirmations do not establish canonical finality.",
    "Reorg and transaction-replacement semantics are outside bridge v0.1.",
    "Reviewed intent/binding declarations are not independent transaction-body decoding.",
    "An API or indexer observation does not prove an on-chain effect."
  ],
  "outcomeEnvelopeCount": 6,
  "requestEnvelopeCount": 7,
  "schemaVersion": "cgqa-ltp-continuity-bridge-report-v0.1"
}
